<?xml version="1.0" encoding="ISO-8859-1"?>
<lib:library 
    xmlns:xsi="http://www.w3.org/2001/XMLSchema-instance" 
    xsi:schemaLocation="https://www.ana-escobar.com/library/ library.xsd"
    xmlns:lib="https://www.ana-escobar.com/library/">
    <!-- xsi:noNamespaceSchemaLocation="library.xsd"> -->
    <!-- BOOKS -->
    <lib:book id="b1">
        <lib:kinds>
            <lib:kind>comic</lib:kind>
        </lib:kinds>
        <lib:title>CSI: crime scene investigation</lib:title>
        <lib:authors>
            <lib:bookauthor authorId="a1" />
        </lib:authors>
        <lib:editorial>Pocket Books</lib:editorial>
        <lib:type>consult</lib:type>
        <lib:isbn>0743444043</lib:isbn>
        <lib:publicationYear>2001</lib:publicationYear>
        <lib:abstract>After a room-service waiter stumbles across a killer and a body, Homicide cop Jim Brass summons forensic investigator Gil Grissom and his staff--including Catherine Willows, 
            Warrick Brown, and Sara Sidle--to help solve the mystery.</lib:abstract>
        <lib:nbOfCopies>3</lib:nbOfCopies>
        <lib:availability>3</lib:availability>
        <lib:languages>
            <lib:language lang="english" />
        </lib:languages>
    </lib:book>

    <lib:book id="b2">
        <lib:kinds>
            <lib:kind>history</lib:kind>
        </lib:kinds>        
        <lib:title>Guide de la littérature québécoise</lib:title>
        <lib:authors>
            <lib:bookauthor authorId="a2"/>
        </lib:authors>
        <lib:editorial>Boréal</lib:editorial>
        <lib:type>all</lib:type>
        <lib:isbn>2890522482</lib:isbn>
        <lib:publicationYear>1988</lib:publicationYear>
        <lib:nbOfCopies>4</lib:nbOfCopies>
        <lib:availability>4</lib:availability>
        <lib:languages>
            <lib:language lang="french" />
        </lib:languages>
    </lib:book>

    <lib:book id="b3">
        <lib:kinds>
            <lib:kind>politics</lib:kind>
        </lib:kinds>        
        <lib:title>Evolution and morality</lib:title>
        <lib:authors>
            <lib:bookauthor authorId="a3"/>
            <lib:bookauthor authorId="a4"/>
        </lib:authors>
        <lib:editorial>NYU Press</lib:editorial>
        <lib:type>all</lib:type>
        <lib:isbn>0814771228</lib:isbn>
        <lib:publicationYear>2012</lib:publicationYear>
        <lib:nbOfCopies>2</lib:nbOfCopies>
        <lib:availability>2</lib:availability>
        <lib:languages>
            <lib:language lang="english" />
        </lib:languages>
    </lib:book>

    <lib:book id="b4">
        <lib:kinds>
            <lib:kind>adults</lib:kind>
        </lib:kinds>        
        <lib:title>The Greatest Love Story Ever Told</lib:title>
        <lib:authors>
            <lib:bookauthor authorId="a5" />
            <lib:bookauthor authorId="a6" />
        </lib:authors>
        <lib:editorial>Dutton</lib:editorial>
        <lib:type>all</lib:type>
        <lib:isbn>1101986670</lib:isbn>
        <lib:publicationYear>2018</lib:publicationYear>
        <lib:abstract>Megan Mullally and Nick Offerman reveal the full story behind their epic romance—presented in a series of intimate 
            conversations between the couple, including photos, anecdotes, and the occasional puzzle.</lib:abstract>
        <lib:nbOfCopies>2</lib:nbOfCopies>
        <lib:availability>2</lib:availability>
        <lib:languages>
            <lib:language lang="english" />
        </lib:languages>
    </lib:book>

    <lib:book id="b5">
        <lib:kinds>
            <lib:kind>kids</lib:kind>
        </lib:kinds>        
        <lib:title>Edith the cat who ate an elm tree</lib:title>
        <lib:authors>
            <lib:bookauthor authorId="a7" />
        </lib:authors>
        <lib:editorial>Beeler Large Print</lib:editorial>
        <lib:type>all</lib:type>
        <lib:isbn>1574904914</lib:isbn>
        <lib:publicationYear>2003</lib:publicationYear>
        <lib:abstract></lib:abstract>
        <lib:nbOfCopies>4</lib:nbOfCopies>
        <lib:availability>4</lib:availability>
        <lib:languages>
            <lib:language lang="english" />
        </lib:languages>
    </lib:book>

    <lib:book id="b6">
        <lib:kinds>
            <lib:kind>buisiness</lib:kind>
        </lib:kinds>        
        <lib:title>Money talks</lib:title>
        <lib:authors>
            <lib:bookauthor authorId="a8" />
        </lib:authors>
        <lib:editorial>Peter Pauper Press</lib:editorial>
        <lib:type>consult</lib:type>
        <lib:isbn>0880884428</lib:isbn>
        <lib:publicationYear>1988</lib:publicationYear>
        <lib:nbOfCopies>1</lib:nbOfCopies>
        <lib:availability>1</lib:availability>
        <lib:languages>
            <lib:language lang="english" />
        </lib:languages>
    </lib:book>

    <lib:book id="b7">
        <lib:kinds>
            <lib:kind>scifi</lib:kind>
        </lib:kinds>        
        <lib:title>Harry Potter and the Cursed Child. Parts 1 and 2</lib:title>
        <lib:authors>
            <lib:bookauthor authorId="a9" />
        </lib:authors>
        <lib:editorial>Little, Brown</lib:editorial>
        <lib:type>all</lib:type>
        <lib:isbn>123456789</lib:isbn>
        <lib:publicationYear>2016</lib:publicationYear>
        <lib:abstract>Harry Potter and the Cursed Child is the eighth story in the Harry Potter series and the 
            first official Harry Potter story to be presented on stage.</lib:abstract>
        <lib:nbOfCopies>5</lib:nbOfCopies>
        <lib:availability>5</lib:availability>
        <lib:languages>
            <lib:language lang="english"/>
        </lib:languages>
    </lib:book>

    <lib:book id="b8">
        <lib:kinds>
            <lib:kind>scifi</lib:kind>
        </lib:kinds>        
        <lib:title>Harry Potter and the Sorcerer's Stone</lib:title>
        <lib:authors>
            <lib:bookauthor authorId="a9" />
        </lib:authors>
        <lib:editorial>Scholastic</lib:editorial>
        <lib:type>consult</lib:type>
        <lib:isbn>123456789</lib:isbn>
        <lib:publicationYear>1998</lib:publicationYear>
        <lib:abstract></lib:abstract>
        <lib:nbOfCopies>1</lib:nbOfCopies>
        <lib:availability>1</lib:availability>
        <lib:languages>
            <lib:language lang="english" />
        </lib:languages>
    </lib:book>

    <lib:book id="b9">
        <lib:kinds>
            <lib:kind>science</lib:kind>
        </lib:kinds>        
        <lib:title>Social science in the crucible</lib:title>
        <lib:authors>
            <lib:bookauthor authorId="a10" />
        </lib:authors>
        <lib:editorial>Duke University Press</lib:editorial>
        <lib:type>all</lib:type>
        <lib:isbn>0822314975</lib:isbn>
        <lib:publicationYear>1994</lib:publicationYear>
        <lib:abstract></lib:abstract>
        <lib:nbOfCopies>2</lib:nbOfCopies>
        <lib:availability>0</lib:availability>
        <lib:languages>
            <lib:language lang="english" />
        </lib:languages>
    </lib:book>

    <lib:book id="b10">
        <lib:kinds>
            <lib:kind>science</lib:kind>
        </lib:kinds>        
        <lib:title>Who said it would be easy?</lib:title>
        <lib:authors>
            <lib:bookauthor authorId="a11" />
        </lib:authors>
        <lib:editorial>Arcade Pub., Distributed by Little, Brown</lib:editorial>
        <lib:type>all</lib:type>
        <lib:isbn>1559703024</lib:isbn>
        <lib:publicationYear>1996</lib:publicationYear>
        <lib:edition>1</lib:edition>
        <lib:abstract>One woman's life in the political arena</lib:abstract>
        <lib:nbOfCopies>2</lib:nbOfCopies>
        <lib:availability>0</lib:availability>
        <lib:languages>
            <lib:language lang="english" />
        </lib:languages>
    </lib:book>
    
    <lib:book id="b11">
        <lib:kinds>
            <lib:kind>kids</lib:kind>
        </lib:kinds>        
        <lib:title>Vive la maternelle</lib:title>
        <lib:authors>
            <lib:bookauthor authorId="a12" />
        </lib:authors>
        <lib:editorial>Gallimard jeunesse-Giboulées</lib:editorial>
        <lib:type>all</lib:type>
        <lib:isbn>2070615561</lib:isbn>
        <lib:publicationYear>2008</lib:publicationYear>
        <lib:abstract>Une collection présentant une thématique touchant la vie familiale, 
            sociale et psychologique des enfants en veillant à exposer clairement, en 
            termes simples et sans dénaturer la matière, les concepts et les états d'âme 
            liés au sujet.</lib:abstract>
        <lib:nbOfCopies>3</lib:nbOfCopies>
        <lib:availability>3</lib:availability>
        <lib:languages>
            <lib:language lang="french" />
        </lib:languages>
    </lib:book>

    <lib:book id="b12">
        <lib:kinds>
            <lib:kind>adults</lib:kind>
            <lib:kind>kids</lib:kind>
        </lib:kinds> 
        <lib:title>101 Spanish proverbs</lib:title>
        <lib:authors>
            <lib:bookauthor authorId="a13" />
        </lib:authors>
        <lib:editorial>Passport Books</lib:editorial>
        <lib:type>all</lib:type>
        <lib:isbn>0844272272</lib:isbn>
        <lib:publicationYear>1998</lib:publicationYear>
        <lib:abstract>Understanding Spanish language and culture through common sayings</lib:abstract>
        <lib:nbOfCopies>3</lib:nbOfCopies>
        <lib:availability>3</lib:availability>
        <lib:languages>
            <lib:language lang="english" />
            <lib:language lang="spanish" />
        </lib:languages>
    </lib:book>

    <lib:book id="b13">
        <lib:kinds>
            <lib:kind>adults</lib:kind>
            <lib:kind>kids</lib:kind>
        </lib:kinds> 
        <lib:title>Portugais</lib:title>         
        <lib:authors>
            <lib:bookauthor authorId="a14" />
        </lib:authors>